{
  "name": "Gnome",
  "description": "Gnomes are magical folk created by gods of invention, illusions, and life underground. They are petite folk with big eyes and pointed ears, who live around 425 years. Many gnomes like the feeling of a roof over their head, even if that roof is nothing more than a hat.",
  "creature_type": "Humanoid",
  "size": "Small",
  "size_description": "about 3-4 feet tall",
  "speed": 30,
  "darkvision": 60,
  "traits": {
    "Darkvision": {
      "description": "You have Darkvision with a range of 60 feet.",
      "effects": [
        {
          "type": "grant_darkvision",
          "range": 60
        }
      ]
    },
    "Gnomish Cunning": {
      "description": "You have Advantage on Intelligence, Wisdom, and Charisma saving throws.",
      "effects": [
        {
          "type": "grant_save_advantage",
          "abilities": ["Intelligence", "Wisdom", "Charisma"],
          "display": "Advantage on INT, WIS, and CHA saves"
        }
      ]
    },
    "Gnomish Lineage": {
      "description": "You are part of a lineage that grants you supernatural abilities. Choose Forest Gnome or Rock Gnome. Intelligence, Wisdom, or Charisma is your spellcasting ability for the spells you cast with this trait.",
      "type": "choice",
      "choices": {
        "type": "select_single",
        "count": 1,
        "source": {
          "type": "fixed_list",
          "options": ["Intelligence", "Wisdom", "Charisma"]
        }
      }
    }
  },
  "languages": [
    "Common",
    "Gnomish"
  ],
  "lineages": [
    "Forest Gnome",
    "Rock Gnome"
  ]
}